id,target,comment,label,language,dataset,transformation
25093,La Confédération devrait-elle soutenir davantage les énergies renouvelables?,En particulier les énergies renouvelables indigènes.,FAVOR,fr,X-Stance,"Non, même les énergies renouvelables indigènes."
91166,Approuveriez-vous une interdiction générale de publicité pour l’alcool et le tabac?,"Limiter la publicité sur ces produits considérés comme néfastes relèvent du bon sens, particulièrement pour les publicités ayant comme public-cibles les jeunes.",FAVOR,fr,X-Stance,"Limiter la publicité sur ces produits considérés comme néfastes ne relève pas forcément du bon sens, même pour les publicités ayant comme public-cibles les jeunes."
23209,"Êtes-vous favorable à l'introduction de péages routiers (""Road pricing"") pour le transport individuel motorisé sur les routes très fréquentées?",Je suis pour une vignette différente pour les suisse et les étrangers qui utilisent nos routes au rabais.,AGAINST,fr,X-Stance,Je suis pour une vignette pour les suisse et les étrangers qui utilisent nos routes.
142508,"Êtes-vous favorable à l'introduction de péages routiers (""Road pricing"") pour le transport individuel motorisé sur les routes très fréquentées?","Il faut envisager la solution de manière multimodale. La tarification de la mobilité vise une utilisation plus efficace des capacités routières et ferroviaire, contrairement au Road pricing qui ne vise qu'à limiter le trafic routier.",AGAINST,fr,X-Stance,"Il faut envisager la solution de manière multimodale. La tarification de la mobilité vise une utilisation plus efficace des capacités routières et ferroviaires, et le Road pricing peut y contribuer en limitant le trafic routier."
30495,Une initiative souhaite donner à la Confédération plus de compétences pour prendre des mesures permettant la diminution des coûts de la santé (introduction d'un frein aux coûts). Êtes-vous en faveur de cette proposition?,"Pour les spécialistes de la santé du groupe parlementaire des VERTS, la mise en oeuvre de cette initiative est peu claire. Par ex.: le plafonnement des dépenses se fera-t-il au détriment de la qualité et de la sécurité des soins?",AGAINST,fr,X-Stance,"Pour les spécialistes de la santé du groupe parlementaire des VERTS, la mise en oeuvre de cette initiative est peu claire. Je soutiens l’initiative si, par ex., le plafonnement des dépenses ne se fera pas au détriment de la qualité et de la sécurité des soins."
119177,L'État devrait-il engager davantage de moyens financiers dans l'intégration des étrangers?,"Si le thème est aujourd'hui central en Suisse, c'est parce que les étrangers d'aujourd'hui ne se sont pas intégrés comme ceux d'hier (immigration du Sud de l'Europe des années 50 à 70). Il me semble normal que l'État fasse son maximum pour favoriser cette intégration.",FAVOR,fr,X-Stance,"Si le thème n'est pas aujourd'hui central en Suisse, c'est parce que les étrangers d'aujourd'hui s'intègrent comme ceux d'hier (immigration du Sud de l'Europe des années 50 à 70). Il ne me semble pas normal que l'État engage davantage de moyens pour favoriser cette intégration."
71798,"Seriez-vous favorable à la mise en place d’un service citoyen général obligatoire (service militaire, service civil prolongé ou engagement milicien dans la commune) pour les hommes et les femmes?",L'engagement au service de la communauté ne se fait pas par décret et sous contrainte.,AGAINST,fr,X-Stance,L'engagement au service de la communauté peut se décréter par la contrainte.
127913,"En Suisse, l'interruption de grossesse est autorisée pendant les douze premières semaines de la grossesse. Êtes-vous d'accord avec cela?","Il faut au contraire responsabiliser les gens sur la portée de l'acte sexuel, qui est d'abord un acte de procréation avant un plaisir. La vie humaine commence à la conception. Dépénaliser l'avortement, c'est déresponsabiliser les citoyens, c'est permettre le meurtre au nom de la liberté individuelle.",AGAINST,fr,X-Stance,"Il ne faut pas culpabiliser les gens au sujet de l'acte sexuel, qui est d'abord un acte de plaisir avant un acte de procréation. La vie humaine ne commence pas à la conception. Pénaliser l'avortement, c'est priver les citoyens de leur liberté individuelle.
"
