id,target,comment,label,language,dataset,transformation
88694,Les permis de séjour des migrants et migrantes non ressortissants des Etats membres de l’UE/AELE devraient-ils être obligatoirement liés au respect de la Convention d’intégration?,"Je n'aime pas l'idée de contrainte: on n'intègre pas quelqu'un de force. Par contre, des conventions d'intégration non contraignantes pourraient être intéressantes, si elles permettent d'instaurer un dialogue et incitent et accompagner positivement les étrangers vers l'intégration.",AGAINST,fr,X-Stance,"J'aime l'idée de contrainte: on intègre quelqu'un de force. Des conventions d'intégration contraignantes pourraient être intéressantes, si elles permettent d'instaurer un dialogue et incitent et accompagner les étrangers vers l'intégration."
109077,L'acquisition d'une propriété d'habitation habitée par le propriétaire lui-même doit-elle être encouragée de manière plus importante grâce à des déductions d'impôts pour l'épargne logement?,Il serait judicieux qu'un plus grand nombre de concitoyens puissent accéder à la propriété de leur logement,FAVOR,fr,X-Stance,Il serait judicieux qu'un plus petit nombre de concitoyens puissent accéder à la propriété de leur logement.
122739,Etes-vous favorable à initiative populaire qui demande que le Conseil fédéral soit directement élu par le peuple?,"L'élection par le peuple a actuellement plus de chance de servir le populisme que l'idée de démocratie directe. Par contre, la transparence de cette élection devrait grandement être améliorée, en permettant aux citoyens de savoir comment ont voté ""leurs"" élus.",AGAINST,fr,X-Stance,"L'élection par le peuple a actuellement moins de chance de servir le populisme que l'idée de démocratie directe. Par contre, la transparence de cette élection devrait grandement être améliorée, en permettant aux citoyens de savoir comment ont été choisis leurs élus."
88710,Êtes-vous en faveur d'une libéralisation complète des horaires d'ouverture des magasins (fixation des horaires d'ouverture selon leur propre appréciation)?,"Je suis par contre favorable à une certaine flexibilité pour les magasins de petite taille, comme cela se pratique par exemple à Lausanne. De manière générale, avec la possibilité de faire ses achats on-line, il est moins nécessaire qu'avant d'avoir en permanence des magasins ouverts.",AGAINST,fr,X-Stance,"Je suis par contre défavorable à une certaine flexibilité pour les magasins de petite taille, comme cela se pratique par exemple à Lausanne. De manière générale, malgré la possibilité de faire ses achats on-line, il reste aussi nécessaire qu’avant d’avoir en permanence des magasins ouverts."
82329,"Seriez-vous favorable à la mise en place d’un service citoyen général obligatoire (service militaire, service civil prolongé ou engagement milicien dans la commune) pour les hommes et les femmes?",A condition qu'il soit accompagné d'autres mesures concrètes réalisant l'égalité femmes-hommes.,FAVOR,fr,X-Stance,"Non, même si il est accompagné d'autres mesures concrètes réalisant l'égalité femmes-hommes."
77499,La protection contre le licenciement des travailleur-euse-s âgé-e-s (plus de 50 ans) doit-elle être renforcée?,A mettre en lien avec le besoin de valoriser et prolonger le travail des séniors particulièrement suite à la votation de février 2014 sur l'immigration.,FAVOR,fr,X-Stance,A mettre en lien avec le besoin de dévaloriser et réduire le travail des séniors particulièrement suite à la votation de février 2014 sur l'immigration.
125418,Seriez-vous favorables à un plan hospitalier national qui pourrait également mener à la fermeture de certains hôpitaux?,"Pour un marché libre de la santé, contre un trop grande implication de l'Etat",AGAINST,fr,X-Stance,"Contre un marché libre de la santé, pour un grande implication de l'Etat"
